<?xml version="1.0" encoding="UTF-8"?>
<list enabled="true" xmlns:xsi="http://www.w3.org/2001/XMLSchema-instance" xsi:noNamespaceSchemaLocation="../../xsd/spawns.xsd">
	<spawn name="HuntersVillage">
		<group>
			<npc id="30230" x="115116" y="75923" z="-2576" heading="59000" respawnDelay="60" /> <!-- Edroc -->
			<npc id="30231" x="116109" y="75022" z="-2584" heading="57344" respawnDelay="60" /> <!-- Garette -->
			<npc id="30232" x="115271" y="76705" z="-2648" respawnDelay="60" /> <!-- Sorint -->
			<npc id="30233" x="117129" y="76917" z="-2672" heading="34000" respawnDelay="60" /> <!-- Esmeralda -->
			<npc id="30301" x="116646" y="74820" z="-2584" heading="28672" respawnDelay="60" /> <!-- Hally -->
			<npc id="30610" x="117866" y="76483" z="-2688" heading="35768" respawnDelay="60" /> <!-- Cronos -->
			<npc id="30655" x="115791" y="75867" z="-2712" heading="3000" respawnDelay="60" /> <!-- Isael Silvershadow -->
			<npc id="30684" x="115310" y="75447" z="-2576" heading="12288" respawnDelay="60" /> <!-- Viktor -->
			<npc id="30685" x="115647" y="77114" z="-2648" heading="40960" respawnDelay="60" /> <!-- Baxt -->
			<npc id="30686" x="115435" y="76541" z="-2648" heading="12000" respawnDelay="60" /> <!-- Silva -->
			<npc id="30687" x="117649" y="75415" z="-2648" heading="32768" respawnDelay="60" /> <!-- Vergara -->
			<npc id="30688" x="117613" y="75310" z="-2648" heading="24576" respawnDelay="60" /> <!-- Duning -->
			<npc id="30689" x="119673" y="77618" z="-2240" heading="39864" respawnDelay="60" /> <!-- Siria -->
			<npc id="30690" x="119472" y="77835" z="-2240" heading="49152" respawnDelay="60" /> <!-- Luther -->
			<npc id="30691" x="119249" y="77663" z="-2240" respawnDelay="60" /> <!-- Aren Athebaldt -->
			<npc id="30692" x="119892" y="77284" z="-2240" heading="28672" respawnDelay="60" /> <!-- Stedmiel -->
			<npc id="30693" x="119727" y="77137" z="-2240" heading="16384" respawnDelay="60" /> <!-- Queenien -->
			<npc id="30694" x="119043" y="78586" z="-2160" heading="39000" respawnDelay="60" /> <!-- Scraide -->
			<npc id="30695" x="119156" y="78356" z="-2160" heading="28672" respawnDelay="60" /> <!-- Moses -->
			<npc id="30696" x="118890" y="78104" z="-2160" heading="16384" respawnDelay="60" /> <!-- Page -->
			<npc id="30697" x="118887" y="78752" z="-2160" heading="49152" respawnDelay="60" /> <!-- Videlrien -->
			<npc id="30698" x="118571" y="78513" z="-2160" respawnDelay="60" /> <!-- Evelyn -->
			<npc id="30699" x="120249" y="76031" z="-2256" heading="31768" respawnDelay="60" /> <!-- Medown -->
			<npc id="30700" x="120251" y="76247" z="-2264" heading="40960" respawnDelay="60" /> <!-- Prestan -->
			<npc id="30701" x="120180" y="75807" z="-2264" heading="18384" respawnDelay="60" /> <!-- Errickin -->
			<npc id="30702" x="117491" y="77187" z="-2596" heading="60143" respawnDelay="60" /> <!-- Bernard -->
			<npc id="30703" x="117717" y="77273" z="-2584" heading="45056" respawnDelay="60" /> <!-- Colin -->
			<npc id="30704" x="120100" y="74739" z="-2368" heading="31000" respawnDelay="60" /> <!-- Garvarentz -->
			<npc id="30705" x="120079" y="74847" z="-2368" heading="31000" respawnDelay="60" /> <!-- Chakiris -->
			<npc id="30706" x="120039" y="74650" z="-2368" heading="31000" respawnDelay="60" /> <!-- Lazenby -->
			<npc id="30707" x="117129" y="75848" z="-2728" heading="24368" respawnDelay="60" /> <!-- Raigen -->
			<npc id="30708" x="118210" y="76078" z="-2688" heading="32768" respawnDelay="60" /> <!-- Nasign -->
			<npc id="30709" x="114564" y="78107" z="-2592" heading="60929" respawnDelay="60" /> <!-- Norton -->
			<npc id="30710" x="114512" y="77966" z="-2592" heading="42902" respawnDelay="60" /> <!-- Weston -->
			<npc id="30711" x="115032" y="74395" z="-2592" respawnDelay="60" /> <!-- Byron -->
			<npc id="30712" x="115207" y="74239" z="-2592" heading="8953" respawnDelay="60" /> <!-- Makhis -->
			<npc id="30713" x="118437" y="74051" z="-2384" heading="50000" respawnDelay="60" /> <!-- Gardner -->
			<npc id="30714" x="118306" y="74040" z="-2368" heading="50000" respawnDelay="60" /> <!-- Paros -->
			<npc id="30744" x="117980" y="76704" z="-2592" heading="32768" respawnDelay="60" /> <!-- Grey -->
			<npc id="30745" x="115952" y="76000" z="-2721" respawnDelay="60" /> <!-- Tor -->
			<npc id="30746" x="116085" y="74728" z="-2584" heading="10000" respawnDelay="60" /> <!-- Cybellin -->
			<npc id="30764" x="117380" y="75616" z="-2664" heading="26000" respawnDelay="60" /> <!-- Balthazar -->
			<npc id="30831" x="117432" y="76044" z="-2720" heading="15000" respawnDelay="60" /> <!-- Nelson -->
			<!-- <npc id="30990" x="117148" y="76865" z="-2688" heading="34000" respawnDelay="60" /> --> <!-- Lottery Ticket Seller -->
			<npc id="31031" x="116036" y="76319" z="-2720" respawnDelay="60" /> <!-- Broadcasting Tower -->
			<npc id="31051" x="116320" y="74688" z="-2584" heading="16300" respawnDelay="60" /> <!-- Keach -->
			<npc id="31092" x="120493" y="76520" z="-2136" heading="35500" respawnDelay="60" /> <!-- Black Marketeer of Mammon -->
			<npc id="31207" x="117462" y="76074" z="-2712" respawnDelay="60" /> <!-- Sardinia -->
			<npc id="31576" x="116048" y="74716" z="-2584" heading="7000" respawnDelay="60" /> <!-- Berix -->
			<npc id="31603" x="117536" y="77264" z="-2584" heading="56000" respawnDelay="60" /> <!-- Black Cat -->
			<npc id="31604" x="115664" y="77136" z="-2624" heading="50000" respawnDelay="60" /> <!-- Grimst -->
			<npc id="31669" x="117572" y="75592" z="-2648" heading="40000" respawnDelay="60" /> <!-- Onyx -->
			<npc id="31688" x="116144" y="77856" z="-2680" heading="49000" respawnDelay="60" /> <!-- Olympiad Manager -->
			<npc id="31690" x="116096" y="77856" z="-2680" heading="49000" respawnDelay="60" /> <!-- Monument of Heroes -->
			<npc id="32217" x="116080" y="79179" z="-2384" heading="49151" respawnDelay="60" /> <!-- Barta -->
			<npc id="32218" x="115920" y="79179" z="-2384" heading="49151" respawnDelay="60" /> <!-- Miya -->
			<npc id="32219" x="116119" y="79150" z="-2384" heading="49151" respawnDelay="60" /> <!-- Fabnor -->
			<npc id="32220" x="115886" y="79145" z="-2384" heading="49151" respawnDelay="60" /> <!-- Selsia -->
			<npc id="32327" x="116835" y="77219" z="-2696" heading="32767" respawnDelay="60" /> <!-- Adventurers' Guide -->
			<npc id="32478" x="115656" y="76620" z="-2664" heading="60000" respawnDelay="60" /> <!-- Dimensional Merchant -->
			<npc id="32887" x="117410" y="75082" z="-2648" heading="17108" respawnDelay="60" /> <!-- Metar -->
			<npc id="33100" x="116328" y="76905" z="-2728" heading="56899" respawnDelay="60" /> <!-- Lada -->
			<npc id="33462" x="116468" y="77871" z="-2680" heading="40000" respawnDelay="60" /> <!-- Jonadan -->
			<npc id="33495" x="116345" y="74692" z="-2584" heading="15388" respawnDelay="60" /> <!-- Jyamis -->
			<npc id="33587" x="116911" y="77190" z="-2688" heading="32767" respawnDelay="60" /> <!-- Mentor Guide -->
			<npc id="33685" x="116045" y="77812" z="-2680" heading="49811" respawnDelay="60" /> <!-- Mysterious Butler -->
			<npc id="33918" x="116387" y="75384" z="-2712" heading="20745" respawnDelay="60" /> <!-- Aria Furstmater -->
			<npc id="35277" x="116780" y="75504" z="-2720" heading="20000" respawnDelay="60" /> <!-- Manor Manager -->
			<npc id="34018" x="116503" y="75392" z="-2712" heading="12298" respawnDelay="60" /> <!-- Merlot -->
			<npc id="33946" x="116830" y="77297" z="-2698" heading="36736" respawnDelay="60" /> <!-- Adventure Guildsman -->
			<npc id="34267" x="117598" y="77264" z="-2585" heading="53248" respawnDelay="60" /> <!-- Arcturus -->
			<npc id="34357" x="115966" y="76032" z="-2712" heading="0" respawnDelay="60" /> <!-- Orin -->
		</group>
	</spawn>
</list>