<?xml version="1.0" encoding="UTF-8"?>
<list enabled="true" xmlns:xsi="http://www.w3.org/2001/XMLSchema-instance" xsi:noNamespaceSchemaLocation="../../xsd/spawns.xsd">
	<spawn name="EarthWyrmCave">
		<group>
			<!-- Belenora -->
			<npc id="33506" x="75254" y="-182400" z="-9888" heading="40960" />
			<!-- Dark Elf Soldier -->
			<npc id="33507" x="75210" y="-182546" z="-9896" heading="8192" />
			<npc id="33507" x="76280" y="-182298" z="-9888" heading="0" />
			<npc id="33507" x="75106" y="-182365" z="-9888" heading="8192" />
			<npc id="33507" x="75067" y="-182406" z="-9888" heading="8192" />
			<npc id="33507" x="75150" y="-182417" z="-9896" heading="8192" />
			<npc id="33507" x="75249" y="-182497" z="-9896" heading="8192" />
			<npc id="33507" x="75227" y="-182626" z="-9899" heading="8192" />
			<npc id="33507" x="75292" y="-182532" z="-9896" heading="8192" />
			<npc id="33507" x="75177" y="-182587" z="-9888" heading="8192" />
			<npc id="33507" x="75119" y="-182461" z="-9888" heading="8192" />
			<npc id="33507" x="75166" y="-182505" z="-9888" heading="8192" />
			<npc id="33507" x="76333" y="-182254" z="-9888" heading="0" />
			<npc id="33507" x="75259" y="-182579" z="-9896" heading="8192" />
			<npc id="33507" x="75199" y="-182458" z="-9896" heading="8192" />
			<npc id="33507" x="75133" y="-182552" z="-9864" heading="8192" />
			<npc id="33507" x="75032" y="-182453" z="-9888" heading="8192" />
			<!-- Alejandro -->
			<npc id="33502" x="75179" y="-182148" z="-9888" heading="32768" />
			<!-- Dwarf Soldier -->
			<npc id="33503" x="75067" y="-182208" z="-9896" heading="0" />
			<npc id="33503" x="75015" y="-182211" z="-9896" heading="0" />
			<npc id="33503" x="75067" y="-182148" z="-9896" heading="0" />
			<npc id="33503" x="75012" y="-182148" z="-9896" heading="0" />
			<npc id="33503" x="74955" y="-182145" z="-9896" heading="0" />
			<npc id="33503" x="74952" y="-182082" z="-9896" heading="0" />
			<npc id="33503" x="75015" y="-182082" z="-9896" heading="0" />
			<npc id="33503" x="74952" y="-182211" z="-9896" heading="0" />
			<npc id="33503" x="74949" y="-182019" z="-9880" heading="0" />
			<npc id="33503" x="75015" y="-182019" z="-9896" heading="0" />
			<npc id="33503" x="74952" y="-182269" z="-9896" heading="0" />
			<npc id="33503" x="75015" y="-182272" z="-9896" heading="0" />
			<npc id="33503" x="75067" y="-182272" z="-9896" heading="0" />
			<npc id="33503" x="75067" y="-182022" z="-9896" heading="0" />
			<npc id="33503" x="76277" y="-181919" z="-9896" heading="0" />
			<npc id="33503" x="76342" y="-181971" z="-9896" heading="0" />
			<npc id="33503" x="75067" y="-182085" z="-9896" heading="0" />
			<!-- Teleport Device -->
			<npc id="33513" x="75179" y="-181893" z="-9896" heading="0" />
			<!-- Wooden Medic -->
			<npc id="33505" x="75372" y="-181770" z="-9888" heading="24576" />
			<!-- Dwarf Soldier -->
			<npc id="33504" x="75372" y="-181644" z="-9888" heading="45056" />
			<npc id="33504" x="75459" y="-181612" z="-9896" heading="16384" />
			<npc id="33504" x="75287" y="-181685" z="-9896" heading="32768" />
			<npc id="33504" x="75205" y="-181755" z="-9888" heading="0" />
			<!-- Fernando -->
			<!--
			<npc id="33160" x="77154" y="-182196" z="-9888" heading="30708" />
			-->
		</group>
	</spawn>
</list>