<?xml version="1.0" encoding="UTF-8"?>
<list enabled="true" xmlns:xsi="http://www.w3.org/2001/XMLSchema-instance" xsi:noNamespaceSchemaLocation="../../xsd/spawns.xsd">
	<spawn name="FloranVillage">
		<group>
			<npc id="30078" x="16970" y="170391" z="-3496" heading="61440" /> <!-- Pano -->
			<npc id="30079" x="17836" y="169853" z="-3496" heading="20000" /> <!-- Barder -->
			<npc id="30609" x="17475" y="169556" z="-3496" heading="57344" /> <!-- Creta -->
			<npc id="30767" x="17328" y="170574" z="-3496" heading="56099"> <!-- Auctioneer -->
				<parameters>
					<param name="fnAgitMap" value="floran" />
				</parameters>
			</npc>
			<npc id="31571" x="17232" y="170528" z="-3496" heading="53000" /> <!-- Hufs -->
			<npc id="31773" x="17788" y="169842" z="-3496" heading="20000" /> <!-- Sonin -->
			<npc id="32478" x="17740" y="169800" z="-3496" heading="20000" /> <!-- Dimensional Merchant -->
			<npc id="36737" x="17278" y="169747" z="-3480" heading="49153" /> <!-- Gairin -->
			<npc id="36738" x="17262" y="169863" z="-3496" heading="16857" /> <!-- Ludina -->
			<npc id="36739" x="17870" y="170644" z="-3488" heading="15086" /> <!-- Flon -->
			<npc id="36740" x="17883" y="170537" z="-3504" heading="52191" /> <!-- Danif -->
			<npc id="30981" x="15520" y="174572" z="-3624" heading="57344" /> <!-- Dark Judge -->
			<npc id="30291" x="20943" y="171358" z="-3552" heading="12288" /> <!-- Alex -->
			<npc id="30633" x="13258" y="169790" z="-3704" heading="1000" /> <!-- Evert -->
			<npc id="30626" x="15734" y="174805" z="-3632" /> <!-- Hamil -->
			<npc id="30728" x="10699" y="171474" z="-3560" /> <!-- Leirynn -->
			<npc id="31031" x="17264" y="170160" z="-3496" heading="16384" /> <!-- Broadcasting Tower -->
		</group>
	</spawn>
</list>