<?xml version="1.0" encoding="UTF-8"?>
<list enabled="true" xmlns:xsi="http://www.w3.org/2001/XMLSchema-instance" xsi:noNamespaceSchemaLocation="../../xsd/spawns.xsd">
	<spawn name="TrainingCamp">
		<npc id="4378" x="-114493" y="253597" z="-1536" heading="52509" respawnDelay="60" /> <!-- Manager -->
		<npc id="4378" x="-14131" y="123870" z="-3112" heading="39327" respawnDelay="60" /> <!-- Manager -->
		<npc id="4378" x="16122" y="142810" z="-2696" heading="15689" respawnDelay="60" /> <!-- Manager -->
		<npc id="4378" x="44008" y="-47770" z="-792" heading="53122" respawnDelay="60" /> <!-- Manager -->
		<npc id="4378" x="86993" y="-143248" z="-1288" heading="2058" respawnDelay="60" /> <!-- Manager -->
		<npc id="4378" x="82629" y="53097" z="-1488" heading="10250" respawnDelay="60" /> <!-- Manager -->
		<npc id="4378" x="83290" y="148397" z="-3400" heading="1154" respawnDelay="60" /> <!-- Manager -->
		<npc id="4378" x="111807" y="218957" z="-3536" heading="37605" respawnDelay="60" /> <!-- Manager -->
		<npc id="4378" x="147343" y="-55417" z="-2728" heading="55523" respawnDelay="60" /> <!-- Manager -->
		<npc id="4378" x="147239" y="25625" z="-2008" heading="13027" respawnDelay="60" /> <!-- Manager -->
		<npc id="18912" x="-56650" y="135938" z="-2672" heading="0" respawnDelay="60" /> <!-- Scarecrow -->
	</spawn>
</list>